{
  "$schema": "https://json-schema.org/draft/2020-12/schema",
  "$id": "https://licoarc.com/spec/protocol-lines.json",
  "registryVersion": "licoarc.protocol-lines.v1",
  "definitionStates": [
    "DRAFT",
    "PARTIAL",
    "COMPLETE"
  ],
  "lifecycleStates": [
    "Candidate"
  ],
  "lines": [
    {
      "wireId": "licoarc.protocol-line.v1",
      "generation": 1,
      "protocolLineId": "4cb15568e99396ef2789aec1828ad9dc4878f1cd1a04e28fe3feaac4dc753f4c",
      "lifecycle": "Candidate",
      "definitionStatus": "PARTIAL",
      "sessionEligible": false,
      "publicationEligible": false,
      "mandatoryCapabilities": [
        "licoarc.generic-messaging.v1",
        "licoarc.identity.v1",
        "licoarc.pairwise-protection.v1",
        "licoarc.protocol-foundation.v1",
        "licoarc.reliable-exchange.v1"
      ],
      "definedCapabilities": [
        "licoarc.federation-governance.v1",
        "licoarc.generic-messaging.v1",
        "licoarc.group-collaboration.v1",
        "licoarc.https-transport.v1",
        "licoarc.identity.v1",
        "licoarc.pairwise-protection.v1",
        "licoarc.protocol-foundation.v1",
        "licoarc.reliable-exchange.v1"
      ],
      "protectionProfileIds": [
        "abef93baec2b1a7ecdf67bb3783bc641c0c1be7f3696615462597f323e4b46b5"
      ],
      "stableClaimIds": [
        "SEC-001",
        "SEC-002",
        "SEC-003",
        "SEC-004",
        "SEC-005",
        "SEC-006",
        "SEC-007",
        "SEC-008",
        "SEC-009",
        "SEC-010",
        "SEC-011",
        "SEC-012",
        "SEC-013",
        "SEC-014",
        "SEC-015",
        "SEC-016",
        "SEC-017",
        "SEC-018",
        "SEC-019",
        "SEC-020",
        "SEC-021",
        "SEC-022",
        "SEC-023"
      ],
      "blockers": [
        "SEC-proof-requalification"
      ]
    }
  ],
  "contentIdentity": {
    "name": "ProtocolLineSemanticProjectionV1",
    "algorithm": "SHA-256-over-domain-and-deterministic-CBOR",
    "include": [
      "generation",
      "mandatory-capability-semantic-identities",
      "active-protection-profile-identities",
      "stable-positive-claim-identifiers",
      "session-rules"
    ],
    "exclude": [
      "protocolLineId",
      "wireId",
      "catalogs-containing-identities",
      "lifecycle-and-publication",
      "proof-results-and-tools",
      "formal-bindings",
      "source-and-artifact-digests"
    ]
  },
  "immutability": {
    "publishedBytes": "protocol-line-id-bound-and-immutable",
    "lifecycleRecord": "may-change-without-changing-protocol-line-id",
    "identifierReuse": "forbidden"
  }
}
